{
  "$schema": "https://json-schema.org/draft/2020-12/schema",
  "$id": "https://gmp.dev/contracts/companion/schemas/run-invocation.schema.json",
  "title": "RunInvocation",
  "description": "Optional companion artefact that records the model-agnostic invocation inputs/parameters and outputs (including MAG tool_calls) behind a spine ExecutionContext. The spine Run carries reproducibility hashes only; deployments that need to persist or exchange the literal request/response payload reference this artefact by its contextHash. See run-invocation-interop.md for OpenAI/Anthropic mapping and MAG normalization rules.",
  "type": "object",
  "required": ["contextHash", "inputs"],
  "properties": {
    "contextHash": {
      "type": "string",
      "pattern": "^[a-fA-F0-9]{32}([a-fA-F0-9]{32})?$",
      "description": "Opaque reproducibility digest that ties this invocation record to a spine ExecutionContext. It may equal execution-context.schema.json#configHash when a canonical 64-hex hash is used, or a platform-defined 32-hex digest when documented by the implementation profile."
    },
    "inputs": {
      "type": "object",
      "description": "Normalized request payload sent to the model/agent gateway (MAG). Carries any subset of prompt/message/messages plus declared tools and the selected model.",
      "properties": {
        "prompt": {
          "type": "string",
          "description": "Single-string prompt (legacy/completions style)."
        },
        "message": {
          "type": "string",
          "description": "Single user message convenience form when no full message array is supplied."
        },
        "messages": {
          "type": "array",
          "description": "Ordered chat transcript in MAG-normalized form. Provider-specific shapes (OpenAI roles, Anthropic content blocks) are normalized to {role, content}.",
          "items": {
            "type": "object",
            "required": ["role"],
            "properties": {
              "role": {
                "type": "string",
                "enum": ["system", "user", "assistant", "tool"]
              },
              "content": {
                "description": "String content, or a list of typed content blocks (text/tool_use/tool_result) after MAG normalization.",
                "oneOf": [{ "type": "string" }, { "type": "array", "items": { "type": "object", "additionalProperties": true } }]
              },
              "name": { "type": "string" },
              "tool_call_id": {
                "type": "string",
                "description": "Set on role=tool messages to correlate a tool result with the originating tool call id."
              }
            },
            "additionalProperties": true
          }
        },
        "tools": {
          "type": "array",
          "description": "Tool definitions advertised to the model. MAG normalizes OpenAI function tools and Anthropic tools to {name, description, input_schema}.",
          "items": {
            "type": "object",
            "required": ["name"],
            "properties": {
              "name": { "type": "string", "minLength": 1 },
              "description": { "type": "string" },
              "input_schema": {
                "type": "object",
                "description": "JSON Schema for the tool arguments (Anthropic naming; OpenAI 'parameters' is normalized to this key).",
                "additionalProperties": true
              }
            },
            "additionalProperties": true
          }
        },
        "model": {
          "type": "string",
          "description": "Model identifier when supplied as part of inputs. Mirrors parameters.model; parameters.model is authoritative if both are present."
        },
        "system": {
          "type": "string",
          "description": "System prompt when carried inline with inputs (Anthropic top-level system). Mirrors parameters.system."
        }
      },
      "additionalProperties": true
    },
    "parameters": {
      "type": "object",
      "description": "Decoding/control parameters for the invocation (model selection, system prompt, sampling). Open map; well-known keys are listed for interoperability.",
      "properties": {
        "model": { "type": "string" },
        "system": { "type": "string" },
        "temperature": { "type": "number" },
        "top_p": { "type": "number" },
        "max_tokens": { "type": "integer", "minimum": 1 },
        "stop": {
          "type": "array",
          "items": { "type": "string" }
        }
      },
      "additionalProperties": true
    },
    "outputs": {
      "type": "object",
      "description": "Normalized response payload returned by the MAG. tool_calls is the canonical, provider-agnostic representation of model-requested tool invocations.",
      "properties": {
        "content": {
          "description": "Assistant content: a string, or a list of typed content blocks after MAG normalization.",
          "oneOf": [{ "type": "string" }, { "type": "array", "items": { "type": "object", "additionalProperties": true } }]
        },
        "tool_calls": {
          "type": "array",
          "description": "Model-requested tool invocations as [{ id, name, input }]. OpenAI tool_calls[].function.{name,arguments} and Anthropic tool_use blocks {id,name,input} are normalized to this shape; arguments JSON strings are parsed into input objects.",
          "items": {
            "type": "object",
            "required": ["id", "name", "input"],
            "properties": {
              "id": {
                "type": "string",
                "minLength": 1,
                "description": "Provider-assigned identifier for this tool call, echoed back on the corresponding role=tool result via tool_call_id."
              },
              "name": {
                "type": "string",
                "minLength": 1,
                "description": "Tool name; must match a tools[].name advertised in inputs."
              },
              "input": {
                "type": "object",
                "description": "Decoded tool arguments object (already parsed from any provider-specific JSON string encoding).",
                "additionalProperties": true
              }
            },
            "additionalProperties": false
          }
        },
        "usage": {
          "type": "object",
          "description": "Token/cost usage as reported by the provider (e.g. input_tokens, output_tokens). Open map.",
          "additionalProperties": true
        },
        "finish_reason": {
          "type": "string",
          "description": "Normalized stop reason (e.g. stop, length, tool_calls/tool_use)."
        },
        "model": {
          "type": "string",
          "description": "Resolved model that produced the response."
        },
        "provider": {
          "type": "string",
          "description": "Upstream provider that served the invocation (e.g. openai, anthropic)."
        }
      },
      "additionalProperties": true
    }
  },
  "additionalProperties": false
}
